{
  "schemaVersion": 1,
  "type": "assetPatch",
  "id": "draco66electro.prey-bunny-girls:patch/clothing-security-hat",
  "target": "core:clothing/security-hat",
  "replacements": {
    "icon": "assets/legacy/2196-SecurityHat.png",
    "piece/shirt-collar": "assets/legacy/2196-SecurityHat.png"
  }
}
