{
  "schemaVersion": 1,
  "type": "assetPatch",
  "id": "legacy.smaller-breast-and-butt:patch/player-body",
  "target": "core:player",
  "replacements": {
    "body/butt/pale": "assets/body/butt-pale.png",
    "body/butt/white": "assets/body/butt-white.png",
    "body/butt/tan": "assets/body/butt-tan.png",
    "body/butt/black": "assets/body/butt-black.png"
  }
}
