{
  "schemaVersion": 1,
  "type": "assetPatch",
  "id": "draco66electro.prey-bunny-girls:patch/clothing-knight-breast-plate",
  "target": "core:clothing/knight-breast-plate",
  "replacements": {
    "icon": "assets/legacy/2417-KnightChest.png",
    "piece/chest": "assets/legacy/2417-KnightChest.png"
  }
}
