{
  "schemaVersion": 1,
  "type": "assetPatch",
  "id": "draco66electro.prey-bunny-girls:patch/enemy-zombie-1",
  "target": "core:enemy/zombie-1",
  "replacements": {
    "body/butt": "assets/legacy/2017-Butt.png",
    "body/head": "assets/legacy/2140-Head.png",
    "body/torso-lower": "assets/legacy/2718-TorsoLower_5.png"
  }
}
