{
  "schemaVersion": 1,
  "type": "assetPatch",
  "id": "draco66electro.prey-bunny-girls:patch/clothing-hair-brown-pony-tail",
  "target": "core:clothing/hair-brown-pony-tail",
  "replacements": {
    "icon": "assets/legacy/2345-HairBrownPonyTail.png",
    "piece/hair": "assets/legacy/2345-HairBrownPonyTail.png"
  }
}
