{
  "schemaVersion": 1,
  "type": "assetPatch",
  "id": "datz.goblin-slayer-armor:patch/knight-pants",
  "target": "core:clothing/knight-pants",
  "replacements": {
    "piece/spine": "assets/clothing/KnightBelt.png",
    "piece/hips": "assets/clothing/KnightHips.png",
    "piece/butt": "assets/clothing/KnightButt.png",
    "piece/r-leg-upper": "assets/clothing/KnightRLegUpper.png",
    "piece/l-leg-upper": "assets/clothing/KnightLLegUpper.png"
  }
}
