{
  "schemaVersion": 1,
  "type": "assetPatch",
  "id": "mousai.femboy-refitted-shirt:patch/shirt-1",
  "target": "core:clothing/shirt-1",
  "replacements": {
    "icon": "assets/clothing/legacy/SweaterChest.png",
    "piece/spine": "assets/clothing/legacy/SweaterSpine_1.png",
    "piece/chest": "assets/clothing/legacy/SweaterChest.png"
  }
}
