{
  "schemaVersion": 1,
  "type": "assetPatch",
  "id": "mousai.femboy-refitted-shirt:patch/shirt-2",
  "target": "core:clothing/shirt-2",
  "replacements": {
    "icon": "assets/clothing/legacy/SweaterChest_1.png",
    "piece/spine": "assets/clothing/legacy/SweaterSpine_3.png",
    "piece/chest": "assets/clothing/legacy/SweaterChest_1.png"
  }
}
