{
  "schemaVersion": 1,
  "type": "assetPatch",
  "id": "draco66electro.prey-bunny-girls:patch/clothing-bikini-jewelry",
  "target": "core:clothing/bikini-jewelry",
  "replacements": {
    "icon": "assets/legacy/3065-JewelryChestIcon.png",
    "piece/shirt-chest": "assets/legacy/2121-JewelryChest.png"
  }
}
