{
  "schemaVersion": 1,
  "type": "assetPatch",
  "id": "draco66electro.prey-bunny-girls:patch/clothing-shirt-default",
  "target": "core:clothing/shirt-default",
  "replacements": {
    "icon": "assets/legacy/2206-DefaultShirtChest.png",
    "piece/shirt-chest": "assets/legacy/2206-DefaultShirtChest.png"
  }
}
