{
  "schemaVersion": 1,
  "type": "assetPatch",
  "id": "draco66electro.prey-bunny-girls:patch/clothing-hair-blonde-bowl-red-line",
  "target": "core:clothing/hair-blonde-bowl-red-line",
  "replacements": {
    "icon": "assets/legacy/3011-HairBlondeBowlRedLine.png",
    "piece/hair": "assets/legacy/3011-HairBlondeBowlRedLine.png"
  }
}
