{
  "schemaVersion": 1,
  "type": "assetPatch",
  "id": "draco66electro.prey-bunny-girls:patch/clothing-hair-white-blonde",
  "target": "core:clothing/hair-white-blonde",
  "replacements": {
    "icon": "assets/legacy/2580-HairWhiteBlonde.png",
    "piece/hair": "assets/legacy/2580-HairWhiteBlonde.png"
  }
}
