{
  "schemaVersion": 1,
  "type": "assetPatch",
  "id": "draco66electro.prey-bunny-girls:patch/clothing-shirt-damaged",
  "target": "core:clothing/shirt-damaged",
  "replacements": {
    "icon": "assets/legacy/2055-ShirtDamagedChest.png",
    "piece/chest": "assets/legacy/2055-ShirtDamagedChest.png",
    "piece/spine": "assets/legacy/2567-ShirtDamagedSpine.png"
  }
}
