{
  "schemaVersion": 1,
  "type": "assetPatch",
  "id": "mousai.femboy-refitted-shirt:patch/playboy-bunny-body",
  "target": "core:clothing/playboy-bunny-body",
  "replacements": {
    "icon": "assets/clothing/legacy/PlayboyBunnyChest.png",
    "piece/chest": "assets/clothing/legacy/PlayboyBunnyChest.png",
    "piece/spine": "assets/clothing/legacy/PlayboyBunnySpine.png"
  }
}
