{
  "schemaVersion": 1,
  "type": "assetPatch",
  "id": "legacy.futazombies:patch/zombie-2",
  "target": "core:enemy/zombie-2",
  "replacements": {
    "body/torso-lower": "assets/zombie-2/torso-lower.png",
    "body/butt": "assets/zombie-2/butt.png",
    "body/hips": "assets/zombie-2/hips.png",
    "body/chest": "assets/zombie-2/chest.png",
    "body/neck": "assets/zombie-2/neck.png",
    "body/head": "assets/zombie-2/head.png",
    "body/arm-upper": "assets/zombie-2/arm-upper.png",
    "body/arm-lower": "assets/zombie-2/arm-lower.png",
    "body/hand": "assets/zombie-2/hand.png",
    "body/leg-upper": "assets/zombie-2/leg-upper.png",
    "body/leg-lower": "assets/zombie-2/leg-lower.png",
    "body/foot-left": "assets/zombie-2/foot.png",
    "body/foot-right": "assets/zombie-2/foot.png",
    "body/penis": "assets/zombie-2/penis.png"
  }
}
